<?xml version="1.0" encoding="UTF-8"?>
<resources xmlns:xsi="http://www.w3.org/2001/XMLSchema-instance"
           xsi:noNamespaceSchemaLocation="resources.xsd">

    <directory code="overview-root" name="概览" icon="overview" sortNo="10" visible="true">
        <menus>
            <menu code="workbench-center"
                  name="工作台"
                  path="/admin"
                  component="pages/AdminWorkbenchPage.vue"
                  icon="dashboard"
                  sortNo="10"
                  visible="true"
                  enabled="true">
                <buttons>
                    <button code="workbench-view" name="查看工作台" sortNo="10" visible="true"/>
                </buttons>
            </menu>
        </menus>
    </directory>

    <directory code="platform-root" name="平台管理" icon="platform" sortNo="20" visible="true">
        <menus>
            <menu code="config-center"
                  name="系统配置"
                  path="/admin/configs"
                  component="pages/ConfigsAdminPage.vue"
                  icon="settings"
                  sortNo="10"
                  visible="true"
                  enabled="true">
                <buttons>
                    <button code="config-system-view" name="查看配置" sortNo="10" visible="true">
                        <permissions>
                            <permission code="cfg.view"/>
                        </permissions>
                    </button>
                    <button code="config-system-edit" name="编辑配置" sortNo="20" visible="true">
                        <permissions>
                            <permission code="cfg.edit"/>
                        </permissions>
                    </button>
                    <button code="config-system-preview-push" name="推送配置预览" sortNo="30" visible="true">
                        <permissions>
                            <permission code="cfg.preview.push"/>
                        </permissions>
                    </button>
                </buttons>
            </menu>

            <menu code="api-center"
                  name="接口管理"
                  path="/admin/apis"
                  component="pages/ApisAdminPage.vue"
                  icon="link"
                  sortNo="20"
                  visible="true"
                  enabled="true">
                <buttons>
                    <button code="api-manage-view" name="查看接口" sortNo="10" visible="true">
                        <permissions>
                            <permission code="api.view"/>
                        </permissions>
                    </button>
                    <button code="api-manage-publish" name="发布接口" sortNo="20" visible="true">
                        <permissions>
                            <permission code="api.pub"/>
                        </permissions>
                    </button>
                    <button code="api-manage-disable" name="停用接口" sortNo="30" visible="true">
                        <permissions>
                            <permission code="api.off"/>
                        </permissions>
                    </button>
                    <button code="api-manage-edit" name="编辑接口" sortNo="40" visible="true">
                        <permissions>
                            <permission code="api.edit"/>
                        </permissions>
                    </button>
                </buttons>
            </menu>

            <menu code="resource-center"
                  name="资源管理"
                  path="/admin/resources"
                  component="pages/ResourcesAdminPage.vue"
                  icon="tree"
                  sortNo="30"
                  visible="true"
                  enabled="true">
                <buttons>
                    <button code="resource-manage-view" name="查看资源" sortNo="10" visible="true">
                        <permissions>
                            <permission code="res.view"/>
                        </permissions>
                    </button>
                    <button code="resource-manage-create" name="新增资源" sortNo="20" visible="true">
                        <permissions>
                            <permission code="res.add"/>
                        </permissions>
                    </button>
                    <button code="resource-manage-edit" name="编辑资源" sortNo="30" visible="true">
                        <permissions>
                            <permission code="res.edit"/>
                        </permissions>
                    </button>
                    <button code="resource-manage-delete" name="删除资源" sortNo="40" visible="true">
                        <permissions>
                            <permission code="res.del"/>
                        </permissions>
                    </button>
                    <button code="resource-manage-permission-view" name="查看按钮权限码" sortNo="50" visible="true">
                        <permissions>
                            <permission code="res.perm.view"/>
                        </permissions>
                    </button>
                    <button code="resource-manage-permission-edit" name="维护按钮权限码" sortNo="60" visible="true">
                        <permissions>
                            <permission code="res.perm.edit"/>
                        </permissions>
                    </button>
                </buttons>
            </menu>

            <menu code="dict-center"
                  name="数据字典"
                  path="/admin/dicts"
                  component="pages/DictAdminPage.vue"
                  icon="book"
                  sortNo="40"
                  visible="true"
                  enabled="true">
                <buttons>
                    <button code="dict-manage-view" name="查看字典" sortNo="10" visible="true">
                        <permissions>
                            <permission code="dict.view"/>
                        </permissions>
                    </button>
                    <button code="dict-manage-edit" name="维护字典" sortNo="20" visible="true">
                        <permissions>
                            <permission code="dict.edit"/>
                        </permissions>
                    </button>
                </buttons>
            </menu>

            <menu code="system-file-center"
                  name="系统文件"
                  path="/admin/system-files"
                  component="pages/SystemFilesAdminPage.vue"
                  icon="folder"
                  sortNo="50"
                  visible="true"
                  enabled="true">
                <buttons>
                    <button code="system-file-admin-view" name="查看逻辑文件" sortNo="10" visible="true">
                        <permissions>
                            <permission code="sfl.view"/>
                        </permissions>
                    </button>
                    <button code="system-file-preview" name="预览逻辑文件" sortNo="20" visible="true">
                        <permissions>
                            <permission code="sfl.preview"/>
                        </permissions>
                    </button>
                    <button code="system-file-download" name="下载逻辑文件" sortNo="30" visible="true">
                        <permissions>
                            <permission code="sfl.download"/>
                        </permissions>
                    </button>
                    <button code="system-file-physical-view" name="查看物理文件" sortNo="40" visible="true">
                        <permissions>
                            <permission code="sfl.phys.view"/>
                        </permissions>
                    </button>
                    <button code="system-file-reference-view" name="查看引用关系" sortNo="50" visible="true">
                        <permissions>
                            <permission code="sfl.ref.view"/>
                        </permissions>
                    </button>
                </buttons>
            </menu>

            <menu code="diagnostic-center"
                  name="诊断工具"
                  path="/admin/diagnostic"
                  component="pages/DiagnosticAdminPage.vue"
                  icon="monitor"
                  sortNo="60"
                  visible="true"
                  enabled="true">
                <buttons>
                    <button code="diagnostic-view" name="查看诊断" sortNo="10" visible="true">
                        <permissions>
                            <permission code="diag.view"/>
                        </permissions>
                    </button>
                    <button code="diagnostic-start" name="启动诊断" sortNo="20" visible="true">
                        <permissions>
                            <permission code="diag.start"/>
                        </permissions>
                    </button>
                    <button code="diagnostic-edit" name="调整诊断配置" sortNo="30" visible="true">
                        <permissions>
                            <permission code="diag.edit"/>
                        </permissions>
                    </button>
                    <button code="diagnostic-stop" name="停止诊断" sortNo="40" visible="true">
                        <permissions>
                            <permission code="diag.stop"/>
                        </permissions>
                    </button>
                </buttons>
            </menu>

            <menu code="method-stat-center"
                  name="方法统计"
                  path="/admin/method-stat"
                  component="pages/MethodStatPage.vue"
                  icon="chart"
                  sortNo="90"
                  visible="false"
                  enabled="true">
                <buttons>
                    <button code="method-stat-switch-view" name="查看统计开关" sortNo="10" visible="true">
                        <permissions>
                            <permission code="mst.switch.view"/>
                        </permissions>